topic_id,title,description
1,Sports,Favorite sports and teams
2,Movies,Film recommendations
3,Technology,Latest gadgets and innovations
4,Books,Book reviews and recommendations
5,Travel,Exploring new destinations
6,Food,Delicious recipes and dining experiences
7,Music,New releases and favorite bands
8,Fashion,Style tips and trends
9,Art,Appreciating and creating art
10,Pets,Cute and funny pet stories
11,Health and Fitness,Wellness and exercise tips
12,Science,Discoveries and scientific breakthroughs
13,Education,Study tips and learning resources
14,Environment,Sustainability and conservation efforts
15,History,Exploring the past
16,Cooking,Recipes and culinary techniques
17,Photography,Tips and inspiration for photography
18,Parenting,Advice and support for parents
19,Finance,Managing personal finances
20,Technology News,Updates on the latest tech news
21,Home Decor,Ideas for home decoration
22,Self-Improvement,Tips for personal growth and development
23,Relationships,Advice and tips for healthy relationships
24,Gaming,Discussion about video games
25,Travel Tips,Guides and tips for traveling
26,Music Recommendations,Sharing favorite songs and artists
27,Movie Reviews,Opinions and reviews of movies
28,Book Club,Discussion about books and literature
29,Health Tips,Tips for maintaining a healthy lifestyle
30,Art Showcase,Sharing and discussing artwork
31,Science Fiction,Discussion about sci-fi books
32,Education News,Updates on the education industry
33,Environmental Issues,Discussion about environmental challenges
34,History Facts,Sharing interesting historical facts
35,Fitness Tips,Exercise routines and fitness advice
36,Travel Destinations,Recommendations for travel destinations
37,Music Concerts,Upcoming music concerts and events
38,Fashion Trends,Latest fashion trends and styles
39,Art History,Exploring the history of art movements
40,Pet Care,Tips and advice for pet care
41,Healthy Recipes,Sharing and exchanging healthy recipes
42,Technology Reviews,Reviews of tech products and gadgets
43,Parenting Support,Support and advice for parents
44,Gaming News,Updates on the gaming industry
45,Travel Experiences,Sharing personal travel experiences
46,Music Genres,Discussion about different music genres
47,Book Recommendations,Recommendations for must-read books
48,Home Organization,Tips for organizing and decluttering
49,Mental Health,Support and discussion about mental health
50,Sports News,Updates on sports events and competitions
51,Art Galleries,Exploring and discussing art galleries
52,Cooking Techniques,Mastering cooking techniques
53,Travel Planning,Planning and organizing trips
54,Music Festivals,Upcoming music festivals and lineups
55,Book Adaptations,Movies and TV shows based on books
56,Fashion Tips,Style advice and fashion tips
57,Art Exhibitions,Upcoming art exhibitions and shows
58,Pet Training,Training tips and tricks for pets
59,Fitness Challenges,Challenges for improving fitness
60,Travel Photography,Tips and techniques for travel photography
61,Music History,Exploring the history of music genres
62,Book Discussions,Discussions about specific books
63,DIY Projects,Do-it-yourself projects and crafts
64,Cooking Inspiration,Inspiration for trying new recipes
65,Outdoor Adventures,Exploring the great outdoors
